{
  "schemaVersion": 1,
  "id": "auth",
  "title": "Authentifizierung — JWT & OAuth Einführung",
  "category": "Grundlagen",
  "locale": "de",
  "tags": ["auth", "jwt", "oauth", "security", "login"],
  "difficulty": "beginner",
  "estimatedMinutes": 5,
  "prerequisites": [],
  "slides": [
    {
      "id": "auth-hook",
      "type": "hook",
      "order": 0,
      "title": "Die Frage",
      "content": {
        "body": "Wie weiß eine App, dass du wirklich du bist — und nicht jemand mit deinem Passwort?",
        "subtitle": "Login ist mehr als ein Formular. Es geht um Identität und Vertrauen."
      }
    },
    {
      "id": "auth-explanation",
      "type": "explanation",
      "order": 1,
      "title": "Einfach erklärt",
      "content": {
        "body": "**Authentifizierung** prüft: Wer bist du? (Login)\n**Autorisierung** prüft: Was darfst du? (Rechte)\n\nNach erfolgreichem Login gibt das Backend oft ein **Token** zurück — z.B. ein **JWT** (JSON Web Token): signierte Daten mit Ablaufzeit.\n\n**OAuth** erlaubt Login über einen Drittanbieter (Google, GitHub): Du autorisierst die App, ohne ihr dein Passwort zu geben.",
        "subtitle": "AuthN = Identität · AuthZ = Berechtigung"
      }
    },
    {
      "id": "auth-real-world",
      "type": "real_world",
      "order": 2,
      "title": "Beispiel aus der Realität",
      "content": {
        "body": "Im Club zeigt der Türsteher deinen **Ausweis** (Identität). Mit dem **Stempel auf dem Handgelenk** (Token) darfst du an die Bar — aber nicht backstage (Autorisierung).\n\nOAuth ist wie „Login mit Google“: Google bestätigt deine Identität, die App bekommt nur ein begrenztes OK.",
        "analogy": "Ausweis = Credentials · Stempel = JWT/Session · Türsteher = Auth-Server"
      }
    },
    {
      "id": "auth-scenario-1",
      "type": "scenario",
      "order": 3,
      "title": "Szenario: Login mit JWT",
      "content": {
        "body": "Nutzer sendet E-Mail + Passwort an `POST /auth/login`.\n\nBackend prüft Hash, erstellt JWT:\n\n`{ \"sub\": \"user_1\", \"role\": \"member\", \"exp\": 1710000000 }`\n\nSigniert mit Secret. Client speichert Token (HttpOnly-Cookie oder Memory) und schickt bei Requests:\n\n`Authorization: Bearer eyJhbG...`",
        "subtitle": "Server prüft Signatur und Ablauf bei jedem Request"
      }
    },
    {
      "id": "auth-scenario-2",
      "type": "scenario",
      "order": 4,
      "title": "Szenario: Login mit Google (OAuth)",
      "content": {
        "body": "Nutzer klickt „Mit Google anmelden“.\n\n1. Redirect zu Google\n2. Nutzer stimmt zu\n3. Google leitet mit **Authorization Code** zurück\n4. Backend tauscht Code gegen Tokens (serverseitig!)\n5. App erstellt eigene Session/JWT\n\nDas Passwort bleibt bei Google — deine App sieht es nie.",
        "subtitle": "Authorization Code Flow — Secret nie im Frontend"
      }
    },
    {
      "id": "auth-beginner-mistake",
      "type": "beginner_mistake",
      "order": 5,
      "title": "Typischer Anfängerfehler",
      "content": {
        "body": "JWT im **localStorage** speichern und glauben, das Token **ersetzt** Backend-Checks.",
        "mistake": "Token im localStorage (XSS-anfällig), JWT-Secret im Frontend, Rollen nur aus dem Token lesen ohne Server-Validierung.",
        "whyDangerous": "XSS kann localStorage auslesen. Manipulierte Tokens oder veraltete Rollen führen zu unberechtigtem Zugriff, wenn das Backend nicht jedes Mal prüft.",
        "codeExample": "// Frontend — nicht vertrauenswürdig!\nif (jwt.role === 'admin') showPanel();\n\n// Backend — Pflicht!\nconst user = verifyJwt(token);\nif (user.role !== 'admin') return 403;"
      }
    },
    {
      "id": "auth-quiz",
      "type": "quiz",
      "order": 6,
      "title": "Mini-Quiz",
      "content": {
        "questions": [
          {
            "id": "auth-q1",
            "kind": "multiple_choice",
            "question": "Was ist der Unterschied zwischen Authentifizierung und Autorisierung?",
            "options": [
              "AuthN = Wer bist du? · AuthZ = Was darfst du?",
              "AuthN = Passwort hashen · AuthZ = CSS laden",
              "Beides bedeutet dasselbe",
              "AuthN ist nur für OAuth"
            ],
            "correctAnswer": "AuthN = Wer bist du? · AuthZ = Was darfst du?",
            "feedbackCorrect": "Genau — Identität vs. Berechtigung.",
            "feedbackWrong": "Authentifizierung und Autorisierung sind zwei getrennte Schritte."
          },
          {
            "id": "auth-q2",
            "kind": "true_false",
            "question": "Bei OAuth gibt die App typischerweise das Passwort des Nutzers beim Drittanbieter nicht direkt ein.",
            "options": ["Wahr", "Falsch"],
            "correctAnswer": "Wahr",
            "feedbackCorrect": "Richtig — der Nutzer autorisiert beim Provider.",
            "feedbackWrong": "OAuth delegiert Login — Passwörter bleiben beim IdP."
          },
          {
            "id": "auth-q3",
            "kind": "multiple_choice",
            "question": "Wo sollte geprüft werden, ob ein JWT gültig ist und welche Rolle der Nutzer hat?",
            "options": [
              "Im Backend bei jedem geschützten Endpoint",
              "Nur im Frontend beim Rendern",
              "In der robots.txt",
              "Gar nicht — JWT ist selbstvalidierend genug"
            ],
            "correctAnswer": "Im Backend bei jedem geschützten Endpoint",
            "feedbackCorrect": "Korrekt — Server ist die Quelle der Wahrheit.",
            "feedbackWrong": "Frontend-Checks sind UX — Sicherheit passiert serverseitig."
          }
        ]
      }
    }
  ]
}
